{"k":"eval_report","v":1,"generated_s":1792972800.0,"thresholds":{"min_n":12,"min_species_n":2,"min_bin_n":2},"input":{"label_records":28,"label_events":26,"unmatched_labels":1,"excluded_human_voice":2,"excluded_unsure":1,"excluded_artifact":1,"species_truth":18,"rejections":3},"variants":[{"name":"birdnet","level":"species","score":"prob","mv":[],"n":18,"no_output":0,"min_n":12,"status":"ok","reason":null,"top1":{"exact":12,"near":4,"exact_rate":0.6667,"with_near_rate":0.8889},"top5":{"exact":14,"near":4,"exact_rate":0.7778,"with_near_rate":1.0},"per_truth":[{"key":"poecile carolinensis","n":14,"top1_exact":10,"top1_near":2,"top5_exact":12,"top5_near":2,"top1_exact_rate":0.7143,"status":"ok"},{"key":"melanerpes aurifrons","n":2,"top1_exact":0,"top1_near":2,"top5_exact":0,"top5_near":2,"top1_exact_rate":0.0,"status":"ok"},{"key":"oecanthus dulcisonans","n":2,"top1_exact":2,"top1_near":0,"top5_exact":2,"top5_near":0,"top1_exact_rate":1.0,"status":"ok"}],"rejections":{"n":3,"repeats_claim":3,"by_reason":[{"reason":"mechanical","n":2,"repeats_claim":2},{"reason":"other_species","n":1,"repeats_claim":1}]},"calibration":{"status":"ok","reason":null,"n":18,"ece":0.3667,"ece_n":18,"min_n":12,"bins":[{"bin":"0.3-0.4","n":2,"mean_conf":0.3,"owner_correct_rate":1.0,"status":"ok"},{"bin":"0.5-0.6","n":2,"mean_conf":0.5,"owner_correct_rate":0.0,"status":"ok"},{"bin":"0.6-0.7","n":2,"mean_conf":0.6,"owner_correct_rate":0.0,"status":"ok"},{"bin":"0.7-0.8","n":2,"mean_conf":0.7,"owner_correct_rate":1.0,"status":"ok"},{"bin":"0.8-0.9","n":2,"mean_conf":0.8,"owner_correct_rate":0.0,"status":"ok"},{"bin":"0.9-1.0","n":8,"mean_conf":0.9,"owner_correct_rate":1.0,"status":"ok"}]}},{"name":"perch","level":"species","score":"logit","mv":["tiny_perch.onnx@a232216a8aa2"],"n":14,"no_output":5,"min_n":12,"status":"ok","reason":null,"top1":{"exact":11,"near":2,"exact_rate":0.7857,"with_near_rate":0.9286},"top5":{"exact":13,"near":0,"exact_rate":0.9286,"with_near_rate":0.9286},"per_truth":[{"key":"poecile carolinensis","n":12,"top1_exact":10,"top1_near":1,"top5_exact":11,"top5_near":0,"top1_exact_rate":0.8333,"status":"ok"},{"key":"melanerpes aurifrons","n":2,"top1_exact":1,"top1_near":1,"top5_exact":2,"top5_near":0,"top1_exact_rate":0.5,"status":"ok"}],"rejections":{"n":2,"repeats_claim":1,"by_reason":[{"reason":"mechanical","n":2,"repeats_claim":1}]},"calibration":{"status":"not_applicable","reason":"score_not_probability","n":14,"ece":null,"ece_n":null,"bins":[]}},{"name":"tags","level":"class","score":"prob","mv":[],"n":18,"no_output":3,"min_n":12,"status":"ok","reason":null,"top1":{"exact":10,"near":0,"exact_rate":0.5556,"with_near_rate":0.5556},"top5":{"exact":18,"near":0,"exact_rate":1.0,"with_near_rate":1.0},"per_truth":[{"key":"bird","n":16,"top1_exact":8,"top1_near":0,"top5_exact":16,"top5_near":0,"top1_exact_rate":0.5,"status":"ok"},{"key":"insect","n":2,"top1_exact":2,"top1_near":0,"top5_exact":2,"top5_near":0,"top1_exact_rate":1.0,"status":"ok"}],"rejections":null,"calibration":{"status":"ok","reason":null,"n":18,"ece":0.3889,"ece_n":18,"min_n":12,"bins":[{"bin":"0.3-0.4","n":2,"mean_conf":0.3,"owner_correct_rate":0.0,"status":"ok"},{"bin":"0.5-0.6","n":6,"mean_conf":0.5,"owner_correct_rate":0.0,"status":"ok"},{"bin":"0.6-0.7","n":8,"mean_conf":0.6,"owner_correct_rate":1.0,"status":"ok"},{"bin":"0.9-1.0","n":2,"mean_conf":0.9,"owner_correct_rate":1.0,"status":"ok"}]}},{"name":"clap","level":"class","score":"prob","mv":[],"n":5,"no_output":16,"min_n":12,"status":"not_measurable","reason":"n_below_min","top1":null,"top5":null,"per_truth":[{"key":"bird","n":5,"top1_exact":null,"top1_near":null,"top5_exact":null,"top5_near":null,"top1_exact_rate":null,"status":"not_measurable"}],"rejections":null,"calibration":{"status":"not_measurable","reason":"n_below_min","n":5,"ece":null,"ece_n":5,"min_n":12,"bins":[{"bin":"0.7-0.8","n":5,"mean_conf":0.7,"owner_correct_rate":1.0,"status":"ok"}]}}],"pairs":[{"a":"birdnet","b":"perch","n_paired":14,"min_n":12,"status":"ok","reason":null,"top1":{"a_only":1,"b_only":2,"p":1.0},"top5":{"a_only":1,"b_only":2,"p":1.0}},{"a":"birdnet","b":"tags","n_paired":18,"min_n":12,"status":"not_measurable","reason":"level_differs","top1":null,"top5":null},{"a":"birdnet","b":"clap","n_paired":5,"min_n":12,"status":"not_measurable","reason":"level_differs","top1":null,"top5":null},{"a":"perch","b":"tags","n_paired":14,"min_n":12,"status":"not_measurable","reason":"level_differs","top1":null,"top5":null},{"a":"perch","b":"clap","n_paired":5,"min_n":12,"status":"not_measurable","reason":"level_differs","top1":null,"top5":null},{"a":"tags","b":"clap","n_paired":5,"min_n":12,"status":"not_measurable","reason":"n_below_min","top1":null,"top5":null}]}
